<?xml version="1.0" encoding="UTF-8"?>
<nodoChiediInformativaPSP xmlns:xsi="http://www.w3.org/2001/XMLSchema-instance" xsi:noNamespaceSchemaLocation="nodoChiediInformativaPSPRisposta.xsd">
  <fault>
    <faultCode>faultCode</faultCode>
    <faultString>faultString</faultString>
    <id>id</id>
    <description>description</description>
    <serial>0</serial>
  </fault>
  <xmlInformativa>MA==</xmlInformativa>
</nodoChiediInformativaPSP>
